<?xml version="1.0" encoding="UTF-8"?>
<TargetEntities xmlns="http://www.example.org/metadata" xmlns:xsi="http://www.w3.org/2001/XMLSchema-instance" 
                xsi:schemaLocation="http://www.example.org/metadata ../../../Schema/Target.xsd ">

  <entity name="SR">
    <attributes>
      <const targetpath="ACTLABHRS" value="0.0" type="double"/>
      <const targetpath="ACTLABCOST" value="0.0" type="double"/>
      <attribute name="ACTLABCOST" targetpath="ACTLABCOST" type="double"/>
    </attributes>    
  </entity>

  <entity name="invissue">
    <attributes>
      <attribute name="QUANTITY" targetpath="QUANTITY" type="double"/>
      <attribute name="LINECOST" targetpath="LINECOST" type="double"/>
      <attribute name="UNITCOST" targetpath="UNITCOST" type="double"/>
      <attribute name="ACTUALCOST" targetpath="ACTUALCOST" type="double"/>
      <attribute name="QTYRETURNED" targetpath="QTYRETURNED" type="double"/>
    </attributes>
  </entity>
  
</TargetEntities>
